{
  "$schema": "https://json-schema.org/draft/2020-12/schema",
  "$id": "https://ripdock.org/schemas/session-resume.schema.json",
  "title": "session.resume",
  "description": "Signed App request to resume a durable Session over a new ephemeral WebSocket connection.",
  "type": "object",
  "required": [
    "type",
    "protocol_version",
    "session_id",
    "runtime_id",
    "app_device_id",
    "resume_signature"
  ],
  "properties": {
    "type": { "const": "session.resume" },
    "protocol_version": { "const": "1" },
    "session_id": {
      "type": "string",
      "minLength": 1
    },
    "app_device_id": {
      "type": "string",
      "minLength": 1
    },
    "runtime_id": {
      "type": "string",
      "minLength": 1
    },
    "resume_signature": {
      "type": "object",
      "required": ["alg", "key_id", "nonce", "timestamp", "route", "signature"],
      "properties": {
        "alg": {
          "const": "ES256"
        },
        "key_id": {
          "type": "string",
          "minLength": 1
        },
        "nonce": {
          "type": "string",
          "minLength": 16
        },
        "timestamp": {
          "type": "string",
          "pattern": "^\\d{4}-\\d{2}-\\d{2}T\\d{2}:\\d{2}:\\d{2}(?:\\.\\d{1,9})?Z$"
        },
        "route": {
          "type": "string",
          "minLength": 1
        },
        "signature": {
          "type": "string",
          "minLength": 86,
          "pattern": "^[A-Za-z0-9_-]+$"
        }
      },
      "additionalProperties": false
    },
    "last_event_id": {
      "type": "string",
      "minLength": 1
    },
    "conversation_id": {
      "type": "string",
      "minLength": 1
    }
  },
  "additionalProperties": false
}
