{
  "type": "session.resume",
  "protocol_version": "1",
  "session_id": "session-id-1",
  "runtime_id": "runtime-id-1",
  "app_device_id": "app-device-id-1",
  "resume_signature": {
    "alg": "ES256",
    "key_id": "key-id-1",
    "nonce": "nonce-1234567890",
    "timestamp": "2026-01-01T00:00:00Z",
    "route": "/ripdock/app",
    "signature": "AAAAAAAAAAAAAAAAAAAAAAAAAAAAAAAAAAAAAAAAAAAAAAAAAAAAAAAAAAAAAAAAAAAAAAAAAAAAAAAAAAAAAA"
  }
}
